{
  "$schema": "https://json-schema.org/draft/2020-12/schema",
  "title": "Second Opinion chord label (PRD 8)",
  "description": "One labelled clip. Beats count from the downbeat (beat 0 = bar 1, beat 1). Symbols use the Second Opinion vocabulary (maj, m, dim, aug, sus2, sus4, 6, m6, 7, maj7, m7, m7b5, dim7, add9, 9, maj9, m9, 7sus4) with an optional /bass, or N for no chord. Checked by tools/eval/eval_chords.py.",
  "type": "object",
  "required": ["audio", "bpm", "downbeat_sec", "key", "chords", "source"],
  "properties": {
    "audio": { "type": "string", "description": "WAV file name, relative to the label file" },
    "bpm": { "type": "number", "exclusiveMinimum": 0 },
    "downbeat_sec": { "type": "number", "minimum": 0, "description": "time of beat 0 in the audio" },
    "key": { "type": "string", "pattern": "^[A-G][b#]? (major|minor)$" },
    "chords": {
      "type": "array",
      "minItems": 1,
      "items": {
        "type": "object",
        "required": ["beat", "len", "symbol"],
        "properties": {
          "beat": { "type": "number", "minimum": 0 },
          "len": { "type": "number", "exclusiveMinimum": 0 },
          "symbol": { "type": "string", "examples": ["Fm9", "Ab/C", "Ebsus4", "N"] }
        }
      }
    },
    "source": { "enum": ["vocal", "keys", "guitar", "loop"] }
  }
}
