{
  "audio": "g_major_vocal_flat.wav",
  "bpm": 120,
  "downbeat_sec": 0.25,
  "key": "G major",
  "chords": [
    {
      "beat": 0.0,
      "len": 4,
      "symbol": "G"
    },
    {
      "beat": 4.0,
      "len": 4,
      "symbol": "Em"
    },
    {
      "beat": 8.0,
      "len": 4,
      "symbol": "C"
    },
    {
      "beat": 12.0,
      "len": 4,
      "symbol": "D"
    },
    {
      "beat": 16.0,
      "len": 4,
      "symbol": "G"
    },
    {
      "beat": 20.0,
      "len": 4,
      "symbol": "Em"
    },
    {
      "beat": 24.0,
      "len": 4,
      "symbol": "C"
    },
    {
      "beat": 28.0,
      "len": 4,
      "symbol": "D"
    }
  ],
  "source": "vocal"
}
