{
  "audio": "bb_detuned_piano.wav",
  "bpm": 100,
  "downbeat_sec": 0.0,
  "key": "Bb major",
  "chords": [
    {
      "beat": 0.0,
      "len": 4,
      "symbol": "Bb"
    },
    {
      "beat": 4.0,
      "len": 4,
      "symbol": "Eb/G"
    },
    {
      "beat": 8.0,
      "len": 4,
      "symbol": "F/A"
    },
    {
      "beat": 12.0,
      "len": 4,
      "symbol": "Bb"
    },
    {
      "beat": 16.0,
      "len": 4,
      "symbol": "Gm"
    },
    {
      "beat": 20.0,
      "len": 4,
      "symbol": "Eb"
    },
    {
      "beat": 24.0,
      "len": 4,
      "symbol": "F"
    },
    {
      "beat": 28.0,
      "len": 4,
      "symbol": "Bb"
    }
  ],
  "source": "keys"
}
