{
  "audio": "ab_major_guitar.wav",
  "bpm": 104,
  "downbeat_sec": 0.3,
  "key": "Ab major",
  "chords": [
    {
      "beat": 0.0,
      "len": 4,
      "symbol": "Ab"
    },
    {
      "beat": 4.0,
      "len": 4,
      "symbol": "Db"
    },
    {
      "beat": 8.0,
      "len": 4,
      "symbol": "Eb"
    },
    {
      "beat": 12.0,
      "len": 4,
      "symbol": "Fm"
    },
    {
      "beat": 16.0,
      "len": 4,
      "symbol": "Ab"
    },
    {
      "beat": 20.0,
      "len": 4,
      "symbol": "Db"
    },
    {
      "beat": 24.0,
      "len": 4,
      "symbol": "Eb"
    },
    {
      "beat": 28.0,
      "len": 4,
      "symbol": "Ab"
    }
  ],
  "source": "guitar"
}
