{
  "audio": "eb_slash_guitar.wav",
  "bpm": 98,
  "downbeat_sec": 0.0,
  "key": "Eb major",
  "chords": [
    {
      "beat": 0.0,
      "len": 4,
      "symbol": "Eb"
    },
    {
      "beat": 4.0,
      "len": 4,
      "symbol": "Ab/C"
    },
    {
      "beat": 8.0,
      "len": 4,
      "symbol": "Bb/D"
    },
    {
      "beat": 12.0,
      "len": 4,
      "symbol": "Eb"
    },
    {
      "beat": 16.0,
      "len": 4,
      "symbol": "Cm"
    },
    {
      "beat": 20.0,
      "len": 4,
      "symbol": "Ab/C"
    },
    {
      "beat": 24.0,
      "len": 4,
      "symbol": "Bb"
    },
    {
      "beat": 28.0,
      "len": 4,
      "symbol": "Eb"
    }
  ],
  "source": "guitar"
}
